SMART-Report /dev/sda
Erstellt: 2026-10-03T23:20:41+02:00
==================================================

smartctl 7.4 2023-08-01 r5530 [x86_64-linux-6.18.42-production+truenas] (local build)
Copyright (C) 2002-23, Bruce Allen, Christian Franke, www.smartmontools.org

=== START OF INFORMATION SECTION ===
Model Family:     Western Digital Green
Device Model:     WDC WD40EZRX-00SPEB0
Serial Number:    WD-WCC4EKKH4ULK
LU WWN Device Id: 5 0014ee 20ada4b81
Firmware Version: 80.00A80
User Capacity:    4,000,753,476,096 bytes [4.00 TB]
Sector Sizes:     512 bytes logical, 4096 bytes physical
Rotation Rate:    5400 rpm
Device is:        In smartctl database 7.3/5528
ATA Version is:   ACS-2 (minor revision not indicated)
SATA Version is:  SATA 3.0, 6.0 Gb/s (current: 6.0 Gb/s)
Local Time is:    Sat Oct  3 23:20:41 2026 CEST
SMART support is: Available - device has SMART capability.
SMART support is: Enabled
AAM feature is:   Unavailable
APM feature is:   Unavailable
Rd look-ahead is: Enabled
Write cache is:   Enabled
DSN feature is:   Unavailable
ATA Security is:  Disabled, frozen [SEC2]
Wt Cache Reorder: Enabled

=== START OF READ SMART DATA SECTION ===
SMART overall-health self-assessment test result: PASSED

General SMART Values:
Offline data collection status:  (0x82)	Offline data collection activity
					was completed without error.
					Auto Offline Data Collection: Enabled.
Self-test execution status:      ( 249)	Self-test routine in progress...
					90% of test remaining.
Total time to complete Offline 
data collection: 		(52320) seconds.
Offline data collection
capabilities: 			 (0x7b) SMART execute Offline immediate.
					Auto Offline data collection on/off support.
					Suspend Offline collection upon new
					command.
					Offline surface scan supported.
					Self-test supported.
					Conveyance Self-test supported.
					Selective Self-test supported.
SMART capabilities:            (0x0003)	Saves SMART data before entering
					power-saving mode.
					Supports SMART auto save timer.
Error logging capability:        (0x01)	Error logging supported.
					General Purpose Logging supported.
Short self-test routine 
recommended polling time: 	 (   2) minutes.
Extended self-test routine
recommended polling time: 	 ( 523) minutes.
Conveyance self-test routine
recommended polling time: 	 (   5) minutes.
SCT capabilities: 	       (0x7035)	SCT Status supported.
					SCT Feature Control supported.
					SCT Data Table supported.

SMART Attributes Data Structure revision number: 16
Vendor Specific SMART Attributes with Thresholds:
ID# ATTRIBUTE_NAME          FLAGS    VALUE WORST THRESH FAIL RAW_VALUE
  1 Raw_Read_Error_Rate     POSR-K   200   200   051    -    0
  3 Spin_Up_Time            POS--K   191   178   021    -    7433
  4 Start_Stop_Count        -O--CK   100   100   000    -    542
  5 Reallocated_Sector_Ct   PO--CK   200   200   140    -    0
  7 Seek_Error_Rate         -OSR-K   100   253   000    -    0
  9 Power_On_Hours          -O--CK   093   093   000    -    5219
 10 Spin_Retry_Count        -O--CK   100   100   000    -    0
 11 Calibration_Retry_Count -O--CK   100   100   000    -    0
 12 Power_Cycle_Count       -O--CK   100   100   000    -    531
192 Power-Off_Retract_Count -O--CK   200   200   000    -    326
193 Load_Cycle_Count        -O--CK   199   199   000    -    5916
194 Temperature_Celsius     -O---K   114   099   000    -    38
196 Reallocated_Event_Count -O--CK   200   200   000    -    0
197 Current_Pending_Sector  -O--CK   200   200   000    -    0
198 Offline_Uncorrectable   ----CK   200   200   000    -    0
199 UDMA_CRC_Error_Count    -O--CK   200   200   000    -    0
200 Multi_Zone_Error_Rate   ---R--   200   200   000    -    0
                            ||||||_ K auto-keep
                            |||||__ C event count
                            ||||___ R error rate
                            |||____ S speed/performance
                            ||_____ O updated online
                            |______ P prefailure warning

General Purpose Log Directory Version 1
SMART           Log Directory Version 1 [multi-sector log support]
Address    Access  R/W   Size  Description
0x00       GPL,SL  R/O      1  Log Directory
0x01           SL  R/O      1  Summary SMART error log
0x02           SL  R/O      5  Comprehensive SMART error log
0x03       GPL     R/O      6  Ext. Comprehensive SMART error log
0x06           SL  R/O      1  SMART self-test log
0x07       GPL     R/O      1  Extended self-test log
0x09           SL  R/W      1  Selective self-test log
0x10       GPL     R/O      1  NCQ Command Error log
0x11       GPL     R/O      1  SATA Phy Event Counters log
0x80-0x9f  GPL,SL  R/W     16  Host vendor specific log
0xa0-0xa7  GPL,SL  VS      16  Device vendor specific log
0xa8-0xb7  GPL,SL  VS       1  Device vendor specific log
0xbd       GPL,SL  VS       1  Device vendor specific log
0xc0       GPL,SL  VS       1  Device vendor specific log
0xc1       GPL     VS      93  Device vendor specific log
0xcf       GPL     VS   65535  Device vendor specific log
0xe0       GPL,SL  R/W      1  SCT Command/Status
0xe1       GPL,SL  R/W      1  SCT Data Transfer

SMART Extended Comprehensive Error Log Version: 1 (6 sectors)
No Errors Logged

SMART Extended Self-test Log Version: 1 (1 sectors)
Num  Test_Description    Status                  Remaining  LifeTime(hours)  LBA_of_first_error
# 1  Short offline       Completed without error       00%      5218         -
# 2  Short offline       Completed without error       00%      5003         -
# 3  Short offline       Completed without error       00%      4979         -
# 4  Extended offline    Completed without error       00%      4966         -
# 5  Short offline       Completed without error       00%      4955         -
# 6  Short offline       Completed without error       00%      4945         -
# 7  Short offline       Completed without error       00%      4834         -
# 8  Short offline       Completed without error       00%      4810         -
# 9  Extended offline    Completed without error       00%      4797         -
#10  Short offline       Completed without error       00%      4786         -
#11  Short offline       Completed without error       00%      4762         -
#12  Short offline       Completed without error       00%      4738         -
#13  Short offline       Completed without error       00%      4714         -
#14  Short offline       Completed without error       00%      4690         -
#15  Short offline       Completed without error       00%      4667         -
#16  Short offline       Completed without error       00%      4643         -
#17  Extended offline    Completed without error       00%      4630         -
#18  Short offline       Completed without error       00%      4619         -

SMART Selective self-test log data structure revision number 1
 SPAN  MIN_LBA  MAX_LBA  CURRENT_TEST_STATUS
    1        0        0  Not_testing
    2        0        0  Not_testing
    3        0        0  Not_testing
    4        0        0  Not_testing
    5        0        0  Not_testing
Selective self-test flags (0x0):
  After scanning selected spans, do NOT read-scan remainder of disk.
If Selective self-test is pending on power-up, resume after 0 minute delay.

SCT Status Version:                  3
SCT Version (vendor specific):       258 (0x0102)
Device State:                        DST executing in background (3)
Current Temperature:                    38 Celsius
Power Cycle Min/Max Temperature:     37/39 Celsius
Lifetime    Min/Max Temperature:     19/53 Celsius
Under/Over Temperature Limit Count:   0/0
Vendor specific:
01 00 00 00 00 00 00 00 00 00 00 00 00 00 00 00
00 00 00 00 00 00 00 00 00 00 00 00 00 00 00 00

SCT Temperature History Version:     2
Temperature Sampling Period:         1 minute
Temperature Logging Interval:        1 minute
Min/Max recommended Temperature:      0/60 Celsius
Min/Max Temperature Limit:           -41/85 Celsius
Temperature History Size (Index):    478 (93)

Index    Estimated Time   Temperature Celsius
  94    2026-10-03 15:23    33  **************
 ...    ..( 30 skipped).    ..  **************
 125    2026-10-03 15:54    33  **************
 126    2026-10-03 15:55    34  ***************
 ...    ..(  3 skipped).    ..  ***************
 130    2026-10-03 15:59    34  ***************
 131    2026-10-03 16:00    35  ****************
 ...    ..(  3 skipped).    ..  ****************
 135    2026-10-03 16:04    35  ****************
 136    2026-10-03 16:05    36  *****************
 ...    ..(  8 skipped).    ..  *****************
 145    2026-10-03 16:14    36  *****************
 146    2026-10-03 16:15    35  ****************
 ...    ..(  7 skipped).    ..  ****************
 154    2026-10-03 16:23    35  ****************
 155    2026-10-03 16:24    34  ***************
 ...    ..(  9 skipped).    ..  ***************
 165    2026-10-03 16:34    34  ***************
 166    2026-10-03 16:35    33  **************
 ...    ..(149 skipped).    ..  **************
 316    2026-10-03 19:05    33  **************
 317    2026-10-03 19:06     ?  -
 318    2026-10-03 19:07    21  **
 319    2026-10-03 19:08    21  **
 320    2026-10-03 19:09    22  ***
 321    2026-10-03 19:10    22  ***
 322    2026-10-03 19:11    22  ***
 323    2026-10-03 19:12    23  ****
 324    2026-10-03 19:13     ?  -
 325    2026-10-03 19:14    25  ******
 ...    ..(  2 skipped).    ..  ******
 328    2026-10-03 19:17    25  ******
 329    2026-10-03 19:18    26  *******
 330    2026-10-03 19:19    26  *******
 331    2026-10-03 19:20    27  ********
 332    2026-10-03 19:21    27  ********
 333    2026-10-03 19:22    27  ********
 334    2026-10-03 19:23    28  *********
 ...    ..(  3 skipped).    ..  *********
 338    2026-10-03 19:27    28  *********
 339    2026-10-03 19:28    29  **********
 ...    ..(  5 skipped).    ..  **********
 345    2026-10-03 19:34    29  **********
 346    2026-10-03 19:35    30  ***********
 ...    ..(  2 skipped).    ..  ***********
 349    2026-10-03 19:38    30  ***********
 350    2026-10-03 19:39    31  ************
 351    2026-10-03 19:40    31  ************
 352    2026-10-03 19:41    31  ************
 353    2026-10-03 19:42    32  *************
 ...    ..(  7 skipped).    ..  *************
 361    2026-10-03 19:50    32  *************
 362    2026-10-03 19:51    33  **************
 ...    ..(  3 skipped).    ..  **************
 366    2026-10-03 19:55    33  **************
 367    2026-10-03 19:56    34  ***************
 ...    ..(  3 skipped).    ..  ***************
 371    2026-10-03 20:00    34  ***************
 372    2026-10-03 20:01    35  ****************
 ...    ..(  3 skipped).    ..  ****************
 376    2026-10-03 20:05    35  ****************
 377    2026-10-03 20:06    36  *****************
 ...    ..(  2 skipped).    ..  *****************
 380    2026-10-03 20:09    36  *****************
 381    2026-10-03 20:10     ?  -
 382    2026-10-03 20:11    37  ******************
 ...    ..( 62 skipped).    ..  ******************
 445    2026-10-03 21:14    37  ******************
 446    2026-10-03 21:15    38  *******************
 ...    ..( 25 skipped).    ..  *******************
 472    2026-10-03 21:41    38  *******************
 473    2026-10-03 21:42    39  ********************
 ...    ..(  3 skipped).    ..  ********************
 477    2026-10-03 21:46    39  ********************
   0    2026-10-03 21:47    38  *******************
 ...    ..( 14 skipped).    ..  *******************
  15    2026-10-03 22:02    38  *******************
  16    2026-10-03 22:03    33  **************
 ...    ..(  3 skipped).    ..  **************
  20    2026-10-03 22:07    33  **************
  21    2026-10-03 22:08    34  ***************
 ...    ..(  3 skipped).    ..  ***************
  25    2026-10-03 22:12    34  ***************
  26    2026-10-03 22:13    35  ****************
 ...    ..(  3 skipped).    ..  ****************
  30    2026-10-03 22:17    35  ****************
  31    2026-10-03 22:18    36  *****************
 ...    ..(  6 skipped).    ..  *****************
  38    2026-10-03 22:25    36  *****************
  39    2026-10-03 22:26    35  ****************
 ...    ..(  6 skipped).    ..  ****************
  46    2026-10-03 22:33    35  ****************
  47    2026-10-03 22:34    34  ***************
 ...    ..( 12 skipped).    ..  ***************
  60    2026-10-03 22:47    34  ***************
  61    2026-10-03 22:48    33  **************
 ...    ..( 31 skipped).    ..  **************
  93    2026-10-03 23:20    33  **************

SCT Error Recovery Control command not supported

Device Statistics (GP/SMART Log 0x04) not supported

Pending Defects log (GP Log 0x0c) not supported

SATA Phy Event Counters (GP Log 0x11)
ID      Size     Value  Description
0x0001  2            0  Command failed due to ICRC error
0x0002  2            0  R_ERR response for data FIS
0x0003  2            0  R_ERR response for device-to-host data FIS
0x0004  2            0  R_ERR response for host-to-device data FIS
0x0005  2            0  R_ERR response for non-data FIS
0x0006  2            0  R_ERR response for device-to-host non-data FIS
0x0007  2            0  R_ERR response for host-to-device non-data FIS
0x0008  2            0  Device-to-host non-data FIS retries
0x0009  2            6  Transition from drive PhyRdy to drive PhyNRdy
0x000a  2            7  Device-to-host register FISes sent due to a COMRESET
0x000b  2            0  CRC errors within host-to-device FIS
0x000f  2            0  R_ERR response for host-to-device data FIS, CRC
0x0012  2            0  R_ERR response for host-to-device non-data FIS, CRC
0x8000  4         6903  Vendor specific

