SMART-Report /dev/sdc
Erstellt: 2026-10-04T00:52:52+02:00
Hinweis: SMART war im Laufwerk abgeschaltet und wurde am 04.10.2026 eingeschaltet, danach Kurztest
==================================================

smartctl 7.4 2023-08-01 r5530 [x86_64-linux-6.18.42-production+truenas] (local build)
Copyright (C) 2002-23, Bruce Allen, Christian Franke, www.smartmontools.org

=== START OF INFORMATION SECTION ===
Device Model:     VK0120GEYJP
Serial Number:    BTWA545404RR120CGN
LU WWN Device Id: 5 5cd2e4 04c134885
Firmware Version: 4IWTHPG1
User Capacity:    120,034,123,776 bytes [120 GB]
Sector Sizes:     512 bytes logical, 4096 bytes physical
Rotation Rate:    Solid State Device
Form Factor:      2.5 inches
TRIM Command:     Available, deterministic, zeroed
Device is:        Not in smartctl database 7.3/5528
ATA Version is:   ACS-2 T13/2015-D revision 3
SATA Version is:  SATA 2.6, 6.0 Gb/s (current: 6.0 Gb/s)
Local Time is:    Sun Oct  4 00:52:52 2026 CEST
SMART support is: Available - device has SMART capability.
SMART support is: Enabled
AAM feature is:   Unavailable
APM feature is:   Unavailable
Rd look-ahead is: Enabled
Write cache is:   Disabled
DSN feature is:   Unavailable
ATA Security is:  Unavailable
Wt Cache Reorder: Enabled

=== START OF READ SMART DATA SECTION ===
SMART overall-health self-assessment test result: PASSED

General SMART Values:
Offline data collection status:  (0x02)	Offline data collection activity
					was completed without error.
					Auto Offline Data Collection: Disabled.
Self-test execution status:      (   0)	The previous self-test routine completed
					without error or no self-test has ever 
					been run.
Total time to complete Offline 
data collection: 		(    2) seconds.
Offline data collection
capabilities: 			 (0x79) SMART execute Offline immediate.
					No Auto Offline data collection support.
					Suspend Offline collection upon new
					command.
					Offline surface scan supported.
					Self-test supported.
					Conveyance Self-test supported.
					Selective Self-test supported.
SMART capabilities:            (0x0003)	Saves SMART data before entering
					power-saving mode.
					Supports SMART auto save timer.
Error logging capability:        (0x01)	Error logging supported.
					General Purpose Logging supported.
Short self-test routine 
recommended polling time: 	 (   1) minutes.
Extended self-test routine
recommended polling time: 	 (  37) minutes.
Conveyance self-test routine
recommended polling time: 	 (  37) minutes.
SCT capabilities: 	       (0x0039)	SCT Status supported.
					SCT Error Recovery Control supported.
					SCT Feature Control supported.
					SCT Data Table supported.

SMART Attributes Data Structure revision number: 1
Vendor Specific SMART Attributes with Thresholds:
ID# ATTRIBUTE_NAME          FLAGS    VALUE WORST THRESH FAIL RAW_VALUE
  1 Raw_Read_Error_Rate     POSR--   130   130   039    -    15977278
  5 Reallocated_Sector_Ct   PO--CK   100   100   001    -    0
  9 Power_On_Hours          -O--CK   100   100   000    -    51379
173 Unknown_Attribute       PO--CK   098   098   001    -    0
175 Program_Fail_Count_Chip PO--CK   100   100   010    -    1279913825210
180 Unused_Rsvd_Blk_Cnt_Tot PO-RCK   130   130   039    -    28887240
194 Temperature_Celsius     -O---K   100   100   000    -    35
196 Reallocated_Event_Count PO--CK   100   100   010    -    0
                            ||||||_ K auto-keep
                            |||||__ C event count
                            ||||___ R error rate
                            |||____ S speed/performance
                            ||_____ O updated online
                            |______ P prefailure warning

General Purpose Log Directory Version 1
SMART           Log Directory Version 1 [multi-sector log support]
Address    Access  R/W   Size  Description
0x00       GPL,SL  R/O      1  Log Directory
0x01       GPL,SL  R/O      1  Summary SMART error log
0x02       GPL,SL  R/O      8  Comprehensive SMART error log
0x03       GPL,SL  R/O     20  Ext. Comprehensive SMART error log
0x04       GPL,SL  R/O      8  Device Statistics log
0x06       GPL,SL  R/O      1  SMART self-test log
0x07       GPL,SL  R/O      2  Extended self-test log
0x09       GPL,SL  R/W      1  Selective self-test log
0x10       GPL,SL  R/O      1  NCQ Command Error log
0x11       GPL,SL  R/O      1  SATA Phy Event Counters log
0x80-0x9f  GPL,SL  R/W     16  Host vendor specific log
0xb0       GPL,SL  VS       1  Device vendor specific log
0xb1       GPL,SL  VS      33  Device vendor specific log
0xb5       GPL,SL  VS       1  Device vendor specific log
0xb6       GPL,SL  VS     127  Device vendor specific log
0xb8       GPL,SL  VS       1  Device vendor specific log
0xb9       GPL     VS    1544  Device vendor specific log
0xb9       SL      VS       8  Device vendor specific log
0xba       GPL     VS    1280  Device vendor specific log
0xd0       GPL,SL  VS       1  Device vendor specific log
0xdf       GPL,SL  VS       1  Device vendor specific log
0xe0       GPL,SL  R/W      1  SCT Command/Status
0xe1       GPL,SL  R/W      1  SCT Data Transfer

SMART Extended Comprehensive Error Log Version: 1 (20 sectors)
No Errors Logged

SMART Extended Self-test Log Version: 1 (2 sectors)
Num  Test_Description    Status                  Remaining  LifeTime(hours)  LBA_of_first_error
# 1  Short offline       Completed without error       00%     51379         -
# 2  Short offline       Completed without error       00%     51333         -
# 3  Short offline       Completed without error       00%     51311         -
# 4  Short offline       Completed without error       00%     51287         -
# 5  Short offline       Completed without error       00%     51287         -
# 6  Short offline       Completed without error       00%     51286         -
# 7  Short offline       Completed without error       00%     51268         -
# 8  Short offline       Completed without error       00%     51244         -
# 9  Extended offline    Completed without error       00%     51221         -
#10  Short offline       Completed without error       00%     51220         -
#11  Short offline       Completed without error       00%     51210         -
#12  Short offline       Completed without error       00%     51189         -
#13  Short offline       Completed without error       00%     51165         -
#14  Extended offline    Completed without error       00%     51142         -
#15  Short offline       Completed without error       00%     51141         -
#16  Short offline       Completed without error       00%     51117         -
#17  Short offline       Completed without error       00%     51093         -
#18  Short offline       Completed without error       00%     51069         -
#19  Short offline       Completed without error       00%     51045         -
#20  Short offline       Completed without error       00%     51021         -
#21  Short offline       Completed without error       00%     50997         -
#22  Extended offline    Completed without error       00%     50974         -
#23  Short offline       Completed without error       00%     50973         -
#24  Short offline       Completed without error       00%     50949         -
#25  Short offline       Completed without error       00%     50925         -

SMART Selective self-test log data structure revision number 1
 SPAN  MIN_LBA  MAX_LBA  CURRENT_TEST_STATUS
    1        0        0  Not_testing
    2        0        0  Not_testing
    3        0        0  Not_testing
    4        0        0  Not_testing
    5        0        0  Not_testing
Selective self-test flags (0x0):
  After scanning selected spans, do NOT read-scan remainder of disk.
If Selective self-test is pending on power-up, resume after 0 minute delay.

SCT Status Version:                  3
SCT Version (vendor specific):       1 (0x0001)
Device State:                        Active (0)
Current Temperature:                    35 Celsius
Power Cycle Min/Max Temperature:     33/35 Celsius
Lifetime    Min/Max Temperature:     20/39 Celsius
Specified Max Operating Temperature:    70 Celsius
Under/Over Temperature Limit Count:   0/0
Vendor specific:
00 00 64 00 00 00 00 00 00 00 00 00 00 00 00 00
00 00 00 00 00 00 00 00 00 00 00 00 00 00 00 00

SCT Temperature History Version:     2
Temperature Sampling Period:         1 minute
Temperature Logging Interval:        1 minute
Min/Max recommended Temperature:      0/70 Celsius
Min/Max Temperature Limit:            0/70 Celsius
Temperature History Size (Index):    478 (93)

Index    Estimated Time   Temperature Celsius
  94    2026-10-03 16:55    31  ************
 ...    ..( 45 skipped).    ..  ************
 140    2026-10-03 17:41    31  ************
 141    2026-10-03 17:42    32  *************
 ...    ..( 63 skipped).    ..  *************
 205    2026-10-03 18:46    32  *************
 206    2026-10-03 18:47    31  ************
 ...    ..( 90 skipped).    ..  ************
 297    2026-10-03 20:18    31  ************
 298    2026-10-03 20:19     ?  -
 299    2026-10-03 20:20    21  **
 300    2026-10-03 20:21    22  ***
 301    2026-10-03 20:22    22  ***
 302    2026-10-03 20:23    23  ****
 303    2026-10-03 20:24    23  ****
 304    2026-10-03 20:25    24  *****
 305    2026-10-03 20:26    24  *****
 306    2026-10-03 20:27    24  *****
 307    2026-10-03 20:28    25  ******
 308    2026-10-03 20:29     ?  -
 309    2026-10-03 20:30    25  ******
 310    2026-10-03 20:31    25  ******
 311    2026-10-03 20:32    26  *******
 ...    ..(  2 skipped).    ..  *******
 314    2026-10-03 20:35    26  *******
 315    2026-10-03 20:36    27  ********
 ...    ..(  2 skipped).    ..  ********
 318    2026-10-03 20:39    27  ********
 319    2026-10-03 20:40    28  *********
 ...    ..(  3 skipped).    ..  *********
 323    2026-10-03 20:44    28  *********
 324    2026-10-03 20:45    29  **********
 ...    ..(  5 skipped).    ..  **********
 330    2026-10-03 20:51    29  **********
 331    2026-10-03 20:52    30  ***********
 ...    ..(  5 skipped).    ..  ***********
 337    2026-10-03 20:58    30  ***********
 338    2026-10-03 20:59    31  ************
 ...    ..(  8 skipped).    ..  ************
 347    2026-10-03 21:08    31  ************
 348    2026-10-03 21:09    32  *************
 ...    ..( 12 skipped).    ..  *************
 361    2026-10-03 21:22    32  *************
 362    2026-10-03 21:23    33  **************
 363    2026-10-03 21:24    33  **************
 364    2026-10-03 21:25    33  **************
 365    2026-10-03 21:26     ?  -
 366    2026-10-03 21:27    33  **************
 ...    ..(  2 skipped).    ..  **************
 369    2026-10-03 21:30    33  **************
 370    2026-10-03 21:31    34  ***************
 ...    ..( 44 skipped).    ..  ***************
 415    2026-10-03 22:16    34  ***************
 416    2026-10-03 22:17    33  **************
 ...    ..( 41 skipped).    ..  **************
 458    2026-10-03 22:59    33  **************
 459    2026-10-03 23:00    34  ***************
 ...    ..( 96 skipped).    ..  ***************
  78    2026-10-04 00:37    34  ***************
  79    2026-10-04 00:38    35  ****************
 ...    ..( 13 skipped).    ..  ****************
  93    2026-10-04 00:52    35  ****************

SCT Error Recovery Control:
           Read: Disabled
          Write: Disabled

Device Statistics (GP Log 0x04)
Page  Offset Size        Value Flags Description
0x01  =====  =               =  ===  == General Statistics (rev 1) ==
0x01  0x008  4             105  ---  Lifetime Power-On Resets
0x01  0x018  6     16131822042  ---  Logical Sectors Written
0x01  0x020  6       319905032  ---  Number of Write Commands
0x01  0x028  6     17296403006  ---  Logical Sectors Read
0x01  0x030  6         9376421  ---  Number of Read Commands
0x01  0x038  6       282269267  ---  Date and Time TimeStamp
0x04  =====  =               =  ===  == General Errors Statistics (rev 1) ==
0x04  0x008  4               0  ---  Number of Reported Uncorrectable Errors
0x04  0x010  4               0  ---  Resets Between Cmd Acceptance and Completion
0x05  =====  =               =  ===  == Temperature Statistics (rev 1) ==
0x05  0x008  1              35  ---  Current Temperature
0x05  0x010  1              32  ---  Average Short Term Temperature
0x05  0x018  1              30  ---  Average Long Term Temperature
0x05  0x020  1              39  ---  Highest Temperature
0x05  0x028  1              24  ---  Lowest Temperature
0x05  0x030  1              35  ---  Highest Average Short Term Temperature
0x05  0x038  1              24  ---  Lowest Average Short Term Temperature
0x05  0x040  1              32  ---  Highest Average Long Term Temperature
0x05  0x048  1              24  ---  Lowest Average Long Term Temperature
0x05  0x050  4               0  ---  Time in Over-Temperature
0x05  0x058  1              70  ---  Specified Maximum Operating Temperature
0x05  0x060  4               0  ---  Time in Under-Temperature
0x05  0x068  1               0  ---  Specified Minimum Operating Temperature
0x06  =====  =               =  ===  == Transport Statistics (rev 1) ==
0x06  0x008  4           14907  ---  Number of Hardware Resets
0x06  0x010  4             396  ---  Number of ASR Events
0x06  0x018  4               0  ---  Number of Interface CRC Errors
0x07  =====  =               =  ===  == Solid State Device Statistics (rev 1) ==
0x07  0x008  1               2  ---  Percentage Used Endurance Indicator
                                |||_ C monitored condition met
                                ||__ D supports DSN
                                |___ N normalized value

Pending Defects log (GP Log 0x0c) not supported

SATA Phy Event Counters (GP Log 0x11)
ID      Size     Value  Description
0x0001  4            0  Command failed due to ICRC error
0x0003  4            0  R_ERR response for device-to-host data FIS
0x0004  4            0  R_ERR response for host-to-device data FIS
0x0006  4            0  R_ERR response for device-to-host non-data FIS
0x000a  4            7  Device-to-host register FISes sent due to a COMRESET
0x000b  4            0  CRC errors within host-to-device FIS
0x000d  4            0  Non-CRC errors within host-to-device FIS

