SMART-Report /dev/sdd
Erstellt: 2026-10-03T23:20:42+02:00
==================================================

smartctl 7.4 2023-08-01 r5530 [x86_64-linux-6.18.42-production+truenas] (local build)
Copyright (C) 2002-23, Bruce Allen, Christian Franke, www.smartmontools.org

=== START OF INFORMATION SECTION ===
Model Family:     Western Digital Green
Device Model:     WDC WD40EZRX-00SPEB0
Serial Number:    WD-WCC4EKKH4HY9
LU WWN Device Id: 5 0014ee 2602f9b35
Firmware Version: 80.00A80
User Capacity:    4,000,753,476,096 bytes [4.00 TB]
Sector Sizes:     512 bytes logical, 4096 bytes physical
Rotation Rate:    5400 rpm
Device is:        In smartctl database 7.3/5528
ATA Version is:   ACS-2 (minor revision not indicated)
SATA Version is:  SATA 3.0, 6.0 Gb/s (current: 6.0 Gb/s)
Local Time is:    Sat Oct  3 23:20:42 2026 CEST
SMART support is: Available - device has SMART capability.
SMART support is: Enabled
AAM feature is:   Unavailable
APM feature is:   Unavailable
Rd look-ahead is: Enabled
Write cache is:   Enabled
DSN feature is:   Unavailable
ATA Security is:  Disabled, frozen [SEC2]
Wt Cache Reorder: Enabled

=== START OF READ SMART DATA SECTION ===
SMART overall-health self-assessment test result: PASSED

General SMART Values:
Offline data collection status:  (0x85)	Offline data collection activity
					was aborted by an interrupting command from host.
					Auto Offline Data Collection: Enabled.
Self-test execution status:      ( 249)	Self-test routine in progress...
					90% of test remaining.
Total time to complete Offline 
data collection: 		(52020) seconds.
Offline data collection
capabilities: 			 (0x7b) SMART execute Offline immediate.
					Auto Offline data collection on/off support.
					Suspend Offline collection upon new
					command.
					Offline surface scan supported.
					Self-test supported.
					Conveyance Self-test supported.
					Selective Self-test supported.
SMART capabilities:            (0x0003)	Saves SMART data before entering
					power-saving mode.
					Supports SMART auto save timer.
Error logging capability:        (0x01)	Error logging supported.
					General Purpose Logging supported.
Short self-test routine 
recommended polling time: 	 (   2) minutes.
Extended self-test routine
recommended polling time: 	 ( 520) minutes.
Conveyance self-test routine
recommended polling time: 	 (   5) minutes.
SCT capabilities: 	       (0x7035)	SCT Status supported.
					SCT Feature Control supported.
					SCT Data Table supported.

SMART Attributes Data Structure revision number: 16
Vendor Specific SMART Attributes with Thresholds:
ID# ATTRIBUTE_NAME          FLAGS    VALUE WORST THRESH FAIL RAW_VALUE
  1 Raw_Read_Error_Rate     POSR-K   200   200   051    -    0
  3 Spin_Up_Time            POS--K   193   175   021    -    7308
  4 Start_Stop_Count        -O--CK   099   099   000    -    1526
  5 Reallocated_Sector_Ct   PO--CK   200   200   140    -    0
  7 Seek_Error_Rate         -OSR-K   100   253   000    -    0
  9 Power_On_Hours          -O--CK   097   097   000    -    2820
 10 Spin_Retry_Count        -O--CK   100   100   000    -    0
 11 Calibration_Retry_Count -O--CK   100   100   000    -    0
 12 Power_Cycle_Count       -O--CK   099   099   000    -    1320
192 Power-Off_Retract_Count -O--CK   199   199   000    -    801
193 Load_Cycle_Count        -O--CK   196   196   000    -    12414
194 Temperature_Celsius     -O---K   114   099   000    -    38
196 Reallocated_Event_Count -O--CK   200   200   000    -    0
197 Current_Pending_Sector  -O--CK   200   200   000    -    0
198 Offline_Uncorrectable   ----CK   200   200   000    -    0
199 UDMA_CRC_Error_Count    -O--CK   200   200   000    -    0
200 Multi_Zone_Error_Rate   ---R--   200   200   000    -    0
                            ||||||_ K auto-keep
                            |||||__ C event count
                            ||||___ R error rate
                            |||____ S speed/performance
                            ||_____ O updated online
                            |______ P prefailure warning

General Purpose Log Directory Version 1
SMART           Log Directory Version 1 [multi-sector log support]
Address    Access  R/W   Size  Description
0x00       GPL,SL  R/O      1  Log Directory
0x01           SL  R/O      1  Summary SMART error log
0x02           SL  R/O      5  Comprehensive SMART error log
0x03       GPL     R/O      6  Ext. Comprehensive SMART error log
0x06           SL  R/O      1  SMART self-test log
0x07       GPL     R/O      1  Extended self-test log
0x09           SL  R/W      1  Selective self-test log
0x10       GPL     R/O      1  NCQ Command Error log
0x11       GPL     R/O      1  SATA Phy Event Counters log
0x80-0x9f  GPL,SL  R/W     16  Host vendor specific log
0xa0-0xa7  GPL,SL  VS      16  Device vendor specific log
0xa8-0xb7  GPL,SL  VS       1  Device vendor specific log
0xbd       GPL,SL  VS       1  Device vendor specific log
0xc0       GPL,SL  VS       1  Device vendor specific log
0xc1       GPL     VS      93  Device vendor specific log
0xcf       GPL     VS   65535  Device vendor specific log
0xe0       GPL,SL  R/W      1  SCT Command/Status
0xe1       GPL,SL  R/W      1  SCT Data Transfer

SMART Extended Comprehensive Error Log Version: 1 (6 sectors)
No Errors Logged

SMART Extended Self-test Log Version: 1 (1 sectors)
Num  Test_Description    Status                  Remaining  LifeTime(hours)  LBA_of_first_error
# 1  Short offline       Completed without error       00%      2820         -
# 2  Short offline       Completed without error       00%       864         -

SMART Selective self-test log data structure revision number 1
 SPAN  MIN_LBA  MAX_LBA  CURRENT_TEST_STATUS
    1        0        0  Not_testing
    2        0        0  Not_testing
    3        0        0  Not_testing
    4        0        0  Not_testing
    5        0        0  Not_testing
Selective self-test flags (0x0):
  After scanning selected spans, do NOT read-scan remainder of disk.
If Selective self-test is pending on power-up, resume after 0 minute delay.

SCT Status Version:                  3
SCT Version (vendor specific):       258 (0x0102)
Device State:                        DST executing in background (3)
Current Temperature:                    38 Celsius
Power Cycle Min/Max Temperature:     37/40 Celsius
Lifetime    Min/Max Temperature:     19/53 Celsius
Under/Over Temperature Limit Count:   0/0
Vendor specific:
01 00 00 00 00 00 00 00 00 00 00 00 00 00 00 00
00 00 00 00 00 00 00 00 00 00 00 00 00 00 00 00

SCT Temperature History Version:     2
Temperature Sampling Period:         1 minute
Temperature Logging Interval:        1 minute
Min/Max recommended Temperature:      0/60 Celsius
Min/Max Temperature Limit:           -41/85 Celsius
Temperature History Size (Index):    478 (399)

Index    Estimated Time   Temperature Celsius
 400    2026-10-03 15:23    38  *******************
 ...    ..(  4 skipped).    ..  *******************
 405    2026-10-03 15:28    38  *******************
 406    2026-10-03 15:29    37  ******************
 ...    ..( 13 skipped).    ..  ******************
 420    2026-10-03 15:43    37  ******************
 421    2026-10-03 15:44    38  *******************
 ...    ..( 18 skipped).    ..  *******************
 440    2026-10-03 16:03    38  *******************
 441    2026-10-03 16:04    39  ********************
 ...    ..(  3 skipped).    ..  ********************
 445    2026-10-03 16:08    39  ********************
 446    2026-10-03 16:09    38  *******************
 447    2026-10-03 16:10    39  ********************
 ...    ..(  3 skipped).    ..  ********************
 451    2026-10-03 16:14    39  ********************
 452    2026-10-03 16:15    40  *********************
 ...    ..(  3 skipped).    ..  *********************
 456    2026-10-03 16:19    40  *********************
 457    2026-10-03 16:20    39  ********************
 ...    ..(  3 skipped).    ..  ********************
 461    2026-10-03 16:24    39  ********************
 462    2026-10-03 16:25    38  *******************
 ...    ..( 12 skipped).    ..  *******************
 475    2026-10-03 16:38    38  *******************
 476    2026-10-03 16:39    39  ********************
 ...    ..(  6 skipped).    ..  ********************
   5    2026-10-03 16:46    39  ********************
   6    2026-10-03 16:47    38  *******************
 ...    ..( 14 skipped).    ..  *******************
  21    2026-10-03 17:02    38  *******************
  22    2026-10-03 17:03    33  **************
  23    2026-10-03 17:04    33  **************
  24    2026-10-03 17:05    33  **************
  25    2026-10-03 17:06    34  ***************
 ...    ..(  2 skipped).    ..  ***************
  28    2026-10-03 17:09    34  ***************
  29    2026-10-03 17:10    35  ****************
 ...    ..(  3 skipped).    ..  ****************
  33    2026-10-03 17:14    35  ****************
  34    2026-10-03 17:15    36  *****************
 ...    ..(  9 skipped).    ..  *****************
  44    2026-10-03 17:25    36  *****************
  45    2026-10-03 17:26    35  ****************
 ...    ..(  4 skipped).    ..  ****************
  50    2026-10-03 17:31    35  ****************
  51    2026-10-03 17:32    34  ***************
 ...    ..(  8 skipped).    ..  ***************
  60    2026-10-03 17:41    34  ***************
  61    2026-10-03 17:42    33  **************
 ...    ..( 68 skipped).    ..  **************
 130    2026-10-03 18:51    33  **************
 131    2026-10-03 18:52    34  ***************
 ...    ..(  2 skipped).    ..  ***************
 134    2026-10-03 18:55    34  ***************
 135    2026-10-03 18:56    35  ****************
 ...    ..(  3 skipped).    ..  ****************
 139    2026-10-03 19:00    35  ****************
 140    2026-10-03 19:01    36  *****************
 ...    ..(  3 skipped).    ..  *****************
 144    2026-10-03 19:05    36  *****************
 145    2026-10-03 19:06    37  ******************
 146    2026-10-03 19:07    37  ******************
 147    2026-10-03 19:08    36  *****************
 ...    ..(  3 skipped).    ..  *****************
 151    2026-10-03 19:12    36  *****************
 152    2026-10-03 19:13    35  ****************
 ...    ..(  4 skipped).    ..  ****************
 157    2026-10-03 19:18    35  ****************
 158    2026-10-03 19:19    34  ***************
 ...    ..(  7 skipped).    ..  ***************
 166    2026-10-03 19:27    34  ***************
 167    2026-10-03 19:28    33  **************
 ...    ..(154 skipped).    ..  **************
 322    2026-10-03 22:03    33  **************
 323    2026-10-03 22:04     ?  -
 324    2026-10-03 22:05    21  **
 325    2026-10-03 22:06    22  ***
 326    2026-10-03 22:07    22  ***
 327    2026-10-03 22:08    23  ****
 328    2026-10-03 22:09    23  ****
 329    2026-10-03 22:10    24  *****
 330    2026-10-03 22:11     ?  -
 331    2026-10-03 22:12    26  *******
 ...    ..(  2 skipped).    ..  *******
 334    2026-10-03 22:15    26  *******
 335    2026-10-03 22:16    27  ********
 336    2026-10-03 22:17    27  ********
 337    2026-10-03 22:18    28  *********
 ...    ..(  3 skipped).    ..  *********
 341    2026-10-03 22:22    28  *********
 342    2026-10-03 22:23    29  **********
 ...    ..(  4 skipped).    ..  **********
 347    2026-10-03 22:28    29  **********
 348    2026-10-03 22:29    30  ***********
 349    2026-10-03 22:30    30  ***********
 350    2026-10-03 22:31    30  ***********
 351    2026-10-03 22:32    31  ************
 ...    ..(  2 skipped).    ..  ************
 354    2026-10-03 22:35    31  ************
 355    2026-10-03 22:36    32  *************
 ...    ..(  6 skipped).    ..  *************
 362    2026-10-03 22:43    32  *************
 363    2026-10-03 22:44    33  **************
 ...    ..(  2 skipped).    ..  **************
 366    2026-10-03 22:47    33  **************
 367    2026-10-03 22:48    34  ***************
 ...    ..(  3 skipped).    ..  ***************
 371    2026-10-03 22:52    34  ***************
 372    2026-10-03 22:53    35  ****************
 ...    ..(  3 skipped).    ..  ****************
 376    2026-10-03 22:57    35  ****************
 377    2026-10-03 22:58    36  *****************
 ...    ..(  4 skipped).    ..  *****************
 382    2026-10-03 23:03    36  *****************
 383    2026-10-03 23:04    37  ******************
 ...    ..(  2 skipped).    ..  ******************
 386    2026-10-03 23:07    37  ******************
 387    2026-10-03 23:08     ?  -
 388    2026-10-03 23:09    38  *******************
 ...    ..( 10 skipped).    ..  *******************
 399    2026-10-03 23:20    38  *******************

SCT Error Recovery Control command not supported

Device Statistics (GP/SMART Log 0x04) not supported

Pending Defects log (GP Log 0x0c) not supported

SATA Phy Event Counters (GP Log 0x11)
ID      Size     Value  Description
0x0001  2            0  Command failed due to ICRC error
0x0002  2            0  R_ERR response for data FIS
0x0003  2            0  R_ERR response for device-to-host data FIS
0x0004  2            0  R_ERR response for host-to-device data FIS
0x0005  2            0  R_ERR response for non-data FIS
0x0006  2            0  R_ERR response for device-to-host non-data FIS
0x0007  2            0  R_ERR response for host-to-device non-data FIS
0x0008  2            0  Device-to-host non-data FIS retries
0x0009  2            6  Transition from drive PhyRdy to drive PhyNRdy
0x000a  2            7  Device-to-host register FISes sent due to a COMRESET
0x000b  2            0  CRC errors within host-to-device FIS
0x000f  2            0  R_ERR response for host-to-device data FIS, CRC
0x0012  2            0  R_ERR response for host-to-device non-data FIS, CRC
0x8000  4         6903  Vendor specific

