SMART-Report WDC_WD40EZRX-00SPEB0 WD-WCC4EKKH4HY9
Erstellt: 2026-10-05T00:25:08+02:00  (Geraetename zum Zeitpunkt: /dev/sdd)
System: ASRock Rack D1541D4U-2T8R, TrueNAS 26.0.0-BETA.3
==================================================

### smartctl -x

smartctl 7.4 2023-08-01 r5530 [x86_64-linux-6.18.42-production+truenas] (local build)
Copyright (C) 2002-23, Bruce Allen, Christian Franke, www.smartmontools.org

=== START OF INFORMATION SECTION ===
Model Family:     Western Digital Green
Device Model:     WDC WD40EZRX-00SPEB0
Serial Number:    WD-WCC4EKKH4HY9
LU WWN Device Id: 5 0014ee 2602f9b35
Firmware Version: 80.00A80
User Capacity:    4,000,753,476,096 bytes [4.00 TB]
Sector Sizes:     512 bytes logical, 4096 bytes physical
Rotation Rate:    5400 rpm
Device is:        In smartctl database 7.3/5528
ATA Version is:   ACS-2 (minor revision not indicated)
SATA Version is:  SATA 3.0, 6.0 Gb/s (current: 6.0 Gb/s)
Local Time is:    Mon Oct  5 00:25:08 2026 CEST
SMART support is: Available - device has SMART capability.
SMART support is: Enabled
AAM feature is:   Unavailable
APM feature is:   Unavailable
Rd look-ahead is: Enabled
Write cache is:   Enabled
DSN feature is:   Unavailable
ATA Security is:  Disabled, frozen [SEC2]
Wt Cache Reorder: Enabled

=== START OF READ SMART DATA SECTION ===
SMART overall-health self-assessment test result: PASSED

General SMART Values:
Offline data collection status:  (0x84)	Offline data collection activity
					was suspended by an interrupting command from host.
					Auto Offline Data Collection: Enabled.
Self-test execution status:      (   0)	The previous self-test routine completed
					without error or no self-test has ever 
					been run.
Total time to complete Offline 
data collection: 		(52020) seconds.
Offline data collection
capabilities: 			 (0x7b) SMART execute Offline immediate.
					Auto Offline data collection on/off support.
					Suspend Offline collection upon new
					command.
					Offline surface scan supported.
					Self-test supported.
					Conveyance Self-test supported.
					Selective Self-test supported.
SMART capabilities:            (0x0003)	Saves SMART data before entering
					power-saving mode.
					Supports SMART auto save timer.
Error logging capability:        (0x01)	Error logging supported.
					General Purpose Logging supported.
Short self-test routine 
recommended polling time: 	 (   2) minutes.
Extended self-test routine
recommended polling time: 	 ( 520) minutes.
Conveyance self-test routine
recommended polling time: 	 (   5) minutes.
SCT capabilities: 	       (0x7035)	SCT Status supported.
					SCT Feature Control supported.
					SCT Data Table supported.

SMART Attributes Data Structure revision number: 16
Vendor Specific SMART Attributes with Thresholds:
ID# ATTRIBUTE_NAME          FLAGS    VALUE WORST THRESH FAIL RAW_VALUE
  1 Raw_Read_Error_Rate     POSR-K   200   200   051    -    0
  3 Spin_Up_Time            POS--K   197   175   021    -    7150
  4 Start_Stop_Count        -O--CK   099   099   000    -    1531
  5 Reallocated_Sector_Ct   PO--CK   200   200   140    -    0
  7 Seek_Error_Rate         -OSR-K   200   200   000    -    0
  9 Power_On_Hours          -O--CK   097   097   000    -    2845
 10 Spin_Retry_Count        -O--CK   100   100   000    -    0
 11 Calibration_Retry_Count -O--CK   100   100   000    -    0
 12 Power_Cycle_Count       -O--CK   099   099   000    -    1324
192 Power-Off_Retract_Count -O--CK   199   199   000    -    803
193 Load_Cycle_Count        -O--CK   196   196   000    -    12417
194 Temperature_Celsius     -O---K   116   099   000    -    36
196 Reallocated_Event_Count -O--CK   200   200   000    -    0
197 Current_Pending_Sector  -O--CK   200   200   000    -    0
198 Offline_Uncorrectable   ----CK   200   200   000    -    0
199 UDMA_CRC_Error_Count    -O--CK   200   200   000    -    0
200 Multi_Zone_Error_Rate   ---R--   200   200   000    -    0
                            ||||||_ K auto-keep
                            |||||__ C event count
                            ||||___ R error rate
                            |||____ S speed/performance
                            ||_____ O updated online
                            |______ P prefailure warning

General Purpose Log Directory Version 1
SMART           Log Directory Version 1 [multi-sector log support]
Address    Access  R/W   Size  Description
0x00       GPL,SL  R/O      1  Log Directory
0x01           SL  R/O      1  Summary SMART error log
0x02           SL  R/O      5  Comprehensive SMART error log
0x03       GPL     R/O      6  Ext. Comprehensive SMART error log
0x06           SL  R/O      1  SMART self-test log
0x07       GPL     R/O      1  Extended self-test log
0x09           SL  R/W      1  Selective self-test log
0x10       GPL     R/O      1  NCQ Command Error log
0x11       GPL     R/O      1  SATA Phy Event Counters log
0x80-0x9f  GPL,SL  R/W     16  Host vendor specific log
0xa0-0xa7  GPL,SL  VS      16  Device vendor specific log
0xa8-0xb7  GPL,SL  VS       1  Device vendor specific log
0xbd       GPL,SL  VS       1  Device vendor specific log
0xc0       GPL,SL  VS       1  Device vendor specific log
0xc1       GPL     VS      93  Device vendor specific log
0xcf       GPL     VS   65535  Device vendor specific log
0xe0       GPL,SL  R/W      1  SCT Command/Status
0xe1       GPL,SL  R/W      1  SCT Data Transfer

SMART Extended Comprehensive Error Log Version: 1 (6 sectors)
No Errors Logged

SMART Extended Self-test Log Version: 1 (1 sectors)
Num  Test_Description    Status                  Remaining  LifeTime(hours)  LBA_of_first_error
# 1  Extended offline    Completed without error       00%      2829         -
# 2  Short offline       Completed without error       00%      2820         -
# 3  Short offline       Completed without error       00%       864         -

SMART Selective self-test log data structure revision number 1
 SPAN  MIN_LBA  MAX_LBA  CURRENT_TEST_STATUS
    1        0        0  Not_testing
    2        0        0  Not_testing
    3        0        0  Not_testing
    4        0        0  Not_testing
    5        0        0  Not_testing
Selective self-test flags (0x0):
  After scanning selected spans, do NOT read-scan remainder of disk.
If Selective self-test is pending on power-up, resume after 0 minute delay.

SCT Status Version:                  3
SCT Version (vendor specific):       258 (0x0102)
Device State:                        Active (0)
Current Temperature:                    36 Celsius
Power Cycle Min/Max Temperature:     34/38 Celsius
Lifetime    Min/Max Temperature:     19/53 Celsius
Under/Over Temperature Limit Count:   0/0
Vendor specific:
01 00 00 00 00 00 00 00 00 00 00 00 00 00 00 00
00 00 00 00 00 00 00 00 00 00 00 00 00 00 00 00

SCT Temperature History Version:     2
Temperature Sampling Period:         1 minute
Temperature Logging Interval:        1 minute
Min/Max recommended Temperature:      0/60 Celsius
Min/Max Temperature Limit:           -41/85 Celsius
Temperature History Size (Index):    478 (460)

Index    Estimated Time   Temperature Celsius
 461    2026-10-04 16:28    35  ****************
 ...    ..( 54 skipped).    ..  ****************
  38    2026-10-04 17:23    35  ****************
  39    2026-10-04 17:24    34  ***************
  40    2026-10-04 17:25    34  ***************
  41    2026-10-04 17:26    34  ***************
  42    2026-10-04 17:27    35  ****************
 ...    ..(  2 skipped).    ..  ****************
  45    2026-10-04 17:30    35  ****************
  46    2026-10-04 17:31    36  *****************
 ...    ..(  2 skipped).    ..  *****************
  49    2026-10-04 17:34    36  *****************
  50    2026-10-04 17:35    37  ******************
 ...    ..(  7 skipped).    ..  ******************
  58    2026-10-04 17:43    37  ******************
  59    2026-10-04 17:44    38  *******************
 ...    ..(  8 skipped).    ..  *******************
  68    2026-10-04 17:53    38  *******************
  69    2026-10-04 17:54    37  ******************
 ...    ..(  3 skipped).    ..  ******************
  73    2026-10-04 17:58    37  ******************
  74    2026-10-04 17:59    36  *****************
 ...    ..(  7 skipped).    ..  *****************
  82    2026-10-04 18:07    36  *****************
  83    2026-10-04 18:08    27  ********
 ...    ..( 75 skipped).    ..  ********
 159    2026-10-04 19:24    27  ********
 160    2026-10-04 19:25    28  *********
 ...    ..( 81 skipped).    ..  *********
 242    2026-10-04 20:47    28  *********
 243    2026-10-04 20:48    27  ********
 ...    ..( 35 skipped).    ..  ********
 279    2026-10-04 21:24    27  ********
 280    2026-10-04 21:25     ?  -
 281    2026-10-04 21:26    28  *********
 ...    ..(  2 skipped).    ..  *********
 284    2026-10-04 21:29    28  *********
 285    2026-10-04 21:30    29  **********
 ...    ..(  3 skipped).    ..  **********
 289    2026-10-04 21:34    29  **********
 290    2026-10-04 21:35    30  ***********
 291    2026-10-04 21:36    30  ***********
 292    2026-10-04 21:37    30  ***********
 293    2026-10-04 21:38    31  ************
 294    2026-10-04 21:39    31  ************
 295    2026-10-04 21:40    31  ************
 296    2026-10-04 21:41    32  *************
 ...    ..(  2 skipped).    ..  *************
 299    2026-10-04 21:44    32  *************
 300    2026-10-04 21:45    33  **************
 301    2026-10-04 21:46    33  **************
 302    2026-10-04 21:47    34  ***************
 ...    ..(  5 skipped).    ..  ***************
 308    2026-10-04 21:53    34  ***************
 309    2026-10-04 21:54    35  ****************
 ...    ..(  2 skipped).    ..  ****************
 312    2026-10-04 21:57    35  ****************
 313    2026-10-04 21:58     ?  -
 314    2026-10-04 21:59    36  *****************
 ...    ..(  4 skipped).    ..  *****************
 319    2026-10-04 22:04    36  *****************
 320    2026-10-04 22:05     ?  -
 321    2026-10-04 22:06    38  *******************
 ...    ..(  7 skipped).    ..  *******************
 329    2026-10-04 22:14    38  *******************
 330    2026-10-04 22:15    37  ******************
 331    2026-10-04 22:16    37  ******************
 332    2026-10-04 22:17    37  ******************
 333    2026-10-04 22:18    36  *****************
 ...    ..( 23 skipped).    ..  *****************
 357    2026-10-04 22:42    36  *****************
 358    2026-10-04 22:43    35  ****************
 ...    ..(  3 skipped).    ..  ****************
 362    2026-10-04 22:47    35  ****************
 363    2026-10-04 22:48    34  ***************
 ...    ..( 19 skipped).    ..  ***************
 383    2026-10-04 23:08    34  ***************
 384    2026-10-04 23:09    35  ****************
 ...    ..( 18 skipped).    ..  ****************
 403    2026-10-04 23:28    35  ****************
 404    2026-10-04 23:29    34  ***************
 405    2026-10-04 23:30    34  ***************
 406    2026-10-04 23:31    34  ***************
 407    2026-10-04 23:32    35  ****************
 408    2026-10-04 23:33    35  ****************
 409    2026-10-04 23:34    35  ****************
 410    2026-10-04 23:35    36  *****************
 ...    ..(  2 skipped).    ..  *****************
 413    2026-10-04 23:38    36  *****************
 414    2026-10-04 23:39    37  ******************
 415    2026-10-04 23:40    37  ******************
 416    2026-10-04 23:41     ?  -
 417    2026-10-04 23:42    37  ******************
 ...    ..(  2 skipped).    ..  ******************
 420    2026-10-04 23:45    37  ******************
 421    2026-10-04 23:46     ?  -
 422    2026-10-04 23:47    37  ******************
 ...    ..(  9 skipped).    ..  ******************
 432    2026-10-04 23:57    37  ******************
 433    2026-10-04 23:58    36  *****************
 ...    ..(  4 skipped).    ..  *****************
 438    2026-10-05 00:03    36  *****************
 439    2026-10-05 00:04    35  ****************
 ...    ..( 20 skipped).    ..  ****************
 460    2026-10-05 00:25    35  ****************

SCT Error Recovery Control command not supported

Device Statistics (GP/SMART Log 0x04) not supported

Pending Defects log (GP Log 0x0c) not supported

SATA Phy Event Counters (GP Log 0x11)
ID      Size     Value  Description
0x0001  2            0  Command failed due to ICRC error
0x0002  2            0  R_ERR response for data FIS
0x0003  2            0  R_ERR response for device-to-host data FIS
0x0004  2            0  R_ERR response for host-to-device data FIS
0x0005  2            0  R_ERR response for non-data FIS
0x0006  2            0  R_ERR response for device-to-host non-data FIS
0x0007  2            0  R_ERR response for host-to-device non-data FIS
0x0008  2            0  Device-to-host non-data FIS retries
0x0009  2            5  Transition from drive PhyRdy to drive PhyNRdy
0x000a  2            6  Device-to-host register FISes sent due to a COMRESET
0x000b  2            0  CRC errors within host-to-device FIS
0x000f  2            0  R_ERR response for host-to-device data FIS, CRC
0x0012  2            0  R_ERR response for host-to-device non-data FIS, CRC
0x8000  4         8478  Vendor specific

