SMART-Report VK0120GEYJP BTWA545404RR120CGN
Erstellt: 2026-10-05T00:25:08+02:00  (Geraetename zum Zeitpunkt: /dev/sda)
System: ASRock Rack D1541D4U-2T8R, TrueNAS 26.0.0-BETA.3
==================================================

### smartctl -x

smartctl 7.4 2023-08-01 r5530 [x86_64-linux-6.18.42-production+truenas] (local build)
Copyright (C) 2002-23, Bruce Allen, Christian Franke, www.smartmontools.org

=== START OF INFORMATION SECTION ===
Device Model:     VK0120GEYJP
Serial Number:    BTWA545404RR120CGN
LU WWN Device Id: 5 5cd2e4 04c134885
Firmware Version: 4IHVHPG6
User Capacity:    120,034,123,776 bytes [120 GB]
Sector Sizes:     512 bytes logical, 4096 bytes physical
Rotation Rate:    Solid State Device
Form Factor:      2.5 inches
TRIM Command:     Available, deterministic, zeroed
Device is:        Not in smartctl database 7.3/5528
ATA Version is:   ACS-3, ATA8-ACS T13/1699-D revision 6
SATA Version is:  SATA 3.1, 6.0 Gb/s (current: 6.0 Gb/s)
Local Time is:    Mon Oct  5 00:25:08 2026 CEST
SMART support is: Available - device has SMART capability.
SMART support is: Enabled
AAM feature is:   Unavailable
APM feature is:   Unavailable
Rd look-ahead is: Enabled
Write cache is:   Disabled
DSN feature is:   Unavailable
ATA Security is:  Unavailable
Wt Cache Reorder: Enabled

=== START OF READ SMART DATA SECTION ===
SMART overall-health self-assessment test result: PASSED

General SMART Values:
Offline data collection status:  (0x02)	Offline data collection activity
					was completed without error.
					Auto Offline Data Collection: Disabled.
Self-test execution status:      (   0)	The previous self-test routine completed
					without error or no self-test has ever 
					been run.
Total time to complete Offline 
data collection: 		(   18) seconds.
Offline data collection
capabilities: 			 (0x79) SMART execute Offline immediate.
					No Auto Offline data collection support.
					Suspend Offline collection upon new
					command.
					Offline surface scan supported.
					Self-test supported.
					Conveyance Self-test supported.
					Selective Self-test supported.
SMART capabilities:            (0x0003)	Saves SMART data before entering
					power-saving mode.
					Supports SMART auto save timer.
Error logging capability:        (0x01)	Error logging supported.
					General Purpose Logging supported.
Short self-test routine 
recommended polling time: 	 (   1) minutes.
Extended self-test routine
recommended polling time: 	 (  37) minutes.
Conveyance self-test routine
recommended polling time: 	 (  37) minutes.
SCT capabilities: 	       (0x0039)	SCT Status supported.
					SCT Error Recovery Control supported.
					SCT Feature Control supported.
					SCT Data Table supported.

SMART Attributes Data Structure revision number: 315
Vendor Specific SMART Attributes with Thresholds:
ID# ATTRIBUTE_NAME          FLAGS    VALUE WORST THRESH FAIL RAW_VALUE
  1 Raw_Read_Error_Rate     POSR--   130   130   039    -    244107375
  5 Reallocated_Sector_Ct   PO--CK   100   100   001    -    0
  9 Power_On_Hours          -O--CK   100   100   000    -    51402
173 Unknown_Attribute       PO--CK   098   098   001    -    0
175 Program_Fail_Count_Chip PO--CK   100   100   010    -    1279909499534
180 Unused_Rsvd_Blk_Cnt_Tot PO-RCK   130   130   039    -    245209727
194 Temperature_Celsius     -O---K   100   100   000    -    31
196 Reallocated_Event_Count PO--CK   100   100   010    -    0
                            ||||||_ K auto-keep
                            |||||__ C event count
                            ||||___ R error rate
                            |||____ S speed/performance
                            ||_____ O updated online
                            |______ P prefailure warning

General Purpose Log Directory Version 1
SMART           Log Directory Version 1 [multi-sector log support]
Address    Access  R/W   Size  Description
0x00       GPL,SL  R/O      1  Log Directory
0x01       GPL,SL  R/O      1  Summary SMART error log
0x02       GPL,SL  R/O      8  Comprehensive SMART error log
0x03       GPL,SL  R/O     20  Ext. Comprehensive SMART error log
0x04       GPL,SL  R/O      8  Device Statistics log
0x06       GPL,SL  R/O      1  SMART self-test log
0x07       GPL,SL  R/O      2  Extended self-test log
0x08       GPL,SL  R/O      2  Power Conditions log
0x09       GPL,SL  R/W      1  Selective self-test log
0x10       GPL,SL  R/O      1  NCQ Command Error log
0x11       GPL,SL  R/O      1  SATA Phy Event Counters log
0x30       GPL,SL  R/O      9  IDENTIFY DEVICE data log
0x80-0x9f  GPL,SL  R/W     16  Host vendor specific log
0xb0       GPL,SL  VS       1  Device vendor specific log
0xb1       GPL,SL  VS      33  Device vendor specific log
0xb5       GPL,SL  VS       1  Device vendor specific log
0xb6       GPL,SL  VS     127  Device vendor specific log
0xb8       GPL,SL  VS       1  Device vendor specific log
0xb9       GPL     VS    1544  Device vendor specific log
0xb9       SL      VS       8  Device vendor specific log
0xba       GPL     VS    1280  Device vendor specific log
0xd0       GPL,SL  VS       1  Device vendor specific log
0xd7       GPL,SL  VS       1  Device vendor specific log
0xdf       GPL,SL  VS       1  Device vendor specific log
0xe0       GPL,SL  R/W      1  SCT Command/Status
0xe1       GPL,SL  R/W      1  SCT Data Transfer

SMART Extended Comprehensive Error Log Version: 1 (20 sectors)
No Errors Logged

SMART Extended Self-test Log Version: 1 (2 sectors)
Num  Test_Description    Status                  Remaining  LifeTime(hours)  LBA_of_first_error
# 1  Extended offline    Completed without error       00%     51400         -

SMART Selective self-test log data structure revision number 1
 SPAN               MIN_LBA              MAX_LBA  CURRENT_TEST_STATUS
    1  17598139360895569665  7205815500360646656  Not_testing
    2                   100    56510930795639305  Not_testing
    3   7061701033839296512                   98  Not_testing
    4  14777359742669960111  9367552869210860036  Not_testing
    5           13225085058       34516034921154  Not_testing
Selective self-test flags (0x0):
  After scanning selected spans, do NOT read-scan remainder of disk.
If Selective self-test is pending on power-up, resume after 0 minute delay.

SCT Status Version:                  3
SCT Version (vendor specific):       1 (0x0001)
Device State:                        Active (0)
Current Temperature:                    31 Celsius
Power Cycle Min/Max Temperature:     31/38 Celsius
Lifetime    Min/Max Temperature:     31/38 Celsius
Specified Max Operating Temperature:    60 Celsius
Under/Over Temperature Limit Count:   0/0
Vendor specific:
00 00 64 00 00 00 00 00 00 00 00 00 00 00 00 00
00 00 00 00 00 00 00 00 00 00 00 00 00 00 00 00

SCT Temperature History Version:     2
Temperature Sampling Period:         1 minute
Temperature Logging Interval:        1 minute
Min/Max recommended Temperature:      0/60 Celsius
Min/Max Temperature Limit:            0/60 Celsius
Temperature History Size (Index):    478 (141)

Index    Estimated Time   Temperature Celsius
 142    2026-10-04 16:28     ?  -
 ...    ..(335 skipped).    ..  -
   0    2026-10-04 22:04     ?  -
   1    2026-10-04 22:05    32  *************
   2    2026-10-04 22:06    32  *************
   3    2026-10-04 22:07    32  *************
   4    2026-10-04 22:08    33  **************
 ...    ..( 16 skipped).    ..  **************
  21    2026-10-04 22:25    33  **************
  22    2026-10-04 22:26    35  ****************
  23    2026-10-04 22:27    35  ****************
  24    2026-10-04 22:28    36  *****************
  25    2026-10-04 22:29    37  ******************
  26    2026-10-04 22:30    37  ******************
  27    2026-10-04 22:31    38  *******************
  28    2026-10-04 22:32    37  ******************
  29    2026-10-04 22:33    36  *****************
  30    2026-10-04 22:34    36  *****************
  31    2026-10-04 22:35    36  *****************
  32    2026-10-04 22:36    35  ****************
 ...    ..(  3 skipped).    ..  ****************
  36    2026-10-04 22:40    35  ****************
  37    2026-10-04 22:41    34  ***************
 ...    ..( 10 skipped).    ..  ***************
  48    2026-10-04 22:52    34  ***************
  49    2026-10-04 22:53    33  **************
 ...    ..( 46 skipped).    ..  **************
  96    2026-10-04 23:40    33  **************
  97    2026-10-04 23:41    32  *************
 ...    ..( 18 skipped).    ..  *************
 116    2026-10-05 00:00    32  *************
 117    2026-10-05 00:01    31  ************
 ...    ..( 23 skipped).    ..  ************
 141    2026-10-05 00:25    31  ************

SCT Error Recovery Control:
           Read: Disabled
          Write: Disabled

Device Statistics (GP Log 0x04)
Page  Offset Size        Value Flags Description
0x01  =====  =               =  ===  == General Statistics (rev 1) ==
0x01  0x008  4             110  ---  Lifetime Power-On Resets
0x01  0x018  6     16157585778  ---  Logical Sectors Written
0x01  0x020  6           79453  ---  Number of Write Commands
0x01  0x028  6     17543520384  ---  Logical Sectors Read
0x01  0x030  6           41050  ---  Number of Read Commands
0x01  0x038  6       366752851  ---  Date and Time TimeStamp
0x04  =====  =               =  ===  == General Errors Statistics (rev 1) ==
0x04  0x008  4               0  ---  Number of Reported Uncorrectable Errors
0x04  0x010  4               0  ---  Resets Between Cmd Acceptance and Completion
0x05  =====  =               =  ===  == Temperature Statistics (rev 1) ==
0x05  0x008  1              31  ---  Current Temperature
0x05  0x010  1               -  ---  Average Short Term Temperature
0x05  0x018  1               -  ---  Average Long Term Temperature
0x05  0x020  1              36  ---  Highest Temperature
0x05  0x028  1              31  ---  Lowest Temperature
0x05  0x030  1               -  ---  Highest Average Short Term Temperature
0x05  0x038  1               -  ---  Lowest Average Short Term Temperature
0x05  0x040  1               -  ---  Highest Average Long Term Temperature
0x05  0x048  1               -  ---  Lowest Average Long Term Temperature
0x05  0x050  4               0  ---  Time in Over-Temperature
0x05  0x058  1              60  ---  Specified Maximum Operating Temperature
0x05  0x060  4               0  ---  Time in Under-Temperature
0x05  0x068  1               0  ---  Specified Minimum Operating Temperature
0x06  =====  =               =  ===  == Transport Statistics (rev 1) ==
0x06  0x008  4               7  ---  Number of Hardware Resets
0x06  0x010  4               5  ---  Number of ASR Events
0x06  0x018  4               0  ---  Number of Interface CRC Errors
0x07  =====  =               =  ===  == Solid State Device Statistics (rev 1) ==
0x07  0x008  1               2  ---  Percentage Used Endurance Indicator
                                |||_ C monitored condition met
                                ||__ D supports DSN
                                |___ N normalized value

Pending Defects log (GP Log 0x0c) not supported

SATA Phy Event Counters (GP Log 0x11)
ID      Size     Value  Description
0x0001  4            0  Command failed due to ICRC error
0x0003  4            0  R_ERR response for device-to-host data FIS
0x0004  4            0  R_ERR response for host-to-device data FIS
0x0006  4            0  R_ERR response for device-to-host non-data FIS
0x000a  4            6  Device-to-host register FISes sent due to a COMRESET
0x000b  4            0  CRC errors within host-to-device FIS
0x000d  4            0  Non-CRC errors within host-to-device FIS

