SMART-Report WDC_WD40EZRX-00SPEB0 WD-WCC4EKKH4ULK
Erstellt: 2026-10-05T00:25:08+02:00  (Geraetename zum Zeitpunkt: /dev/sdb)
System: ASRock Rack D1541D4U-2T8R, TrueNAS 26.0.0-BETA.3
==================================================

### smartctl -x

smartctl 7.4 2023-08-01 r5530 [x86_64-linux-6.18.42-production+truenas] (local build)
Copyright (C) 2002-23, Bruce Allen, Christian Franke, www.smartmontools.org

=== START OF INFORMATION SECTION ===
Model Family:     Western Digital Green
Device Model:     WDC WD40EZRX-00SPEB0
Serial Number:    WD-WCC4EKKH4ULK
LU WWN Device Id: 5 0014ee 20ada4b81
Firmware Version: 80.00A80
User Capacity:    4,000,753,476,096 bytes [4.00 TB]
Sector Sizes:     512 bytes logical, 4096 bytes physical
Rotation Rate:    5400 rpm
Device is:        In smartctl database 7.3/5528
ATA Version is:   ACS-2 (minor revision not indicated)
SATA Version is:  SATA 3.0, 6.0 Gb/s (current: 6.0 Gb/s)
Local Time is:    Mon Oct  5 00:25:08 2026 CEST
SMART support is: Available - device has SMART capability.
SMART support is: Enabled
AAM feature is:   Unavailable
APM feature is:   Unavailable
Rd look-ahead is: Enabled
Write cache is:   Enabled
DSN feature is:   Unavailable
ATA Security is:  Disabled, frozen [SEC2]
Wt Cache Reorder: Enabled

=== START OF READ SMART DATA SECTION ===
SMART overall-health self-assessment test result: PASSED

General SMART Values:
Offline data collection status:  (0x82)	Offline data collection activity
					was completed without error.
					Auto Offline Data Collection: Enabled.
Self-test execution status:      (   0)	The previous self-test routine completed
					without error or no self-test has ever 
					been run.
Total time to complete Offline 
data collection: 		(52320) seconds.
Offline data collection
capabilities: 			 (0x7b) SMART execute Offline immediate.
					Auto Offline data collection on/off support.
					Suspend Offline collection upon new
					command.
					Offline surface scan supported.
					Self-test supported.
					Conveyance Self-test supported.
					Selective Self-test supported.
SMART capabilities:            (0x0003)	Saves SMART data before entering
					power-saving mode.
					Supports SMART auto save timer.
Error logging capability:        (0x01)	Error logging supported.
					General Purpose Logging supported.
Short self-test routine 
recommended polling time: 	 (   2) minutes.
Extended self-test routine
recommended polling time: 	 ( 523) minutes.
Conveyance self-test routine
recommended polling time: 	 (   5) minutes.
SCT capabilities: 	       (0x7035)	SCT Status supported.
					SCT Feature Control supported.
					SCT Data Table supported.

SMART Attributes Data Structure revision number: 16
Vendor Specific SMART Attributes with Thresholds:
ID# ATTRIBUTE_NAME          FLAGS    VALUE WORST THRESH FAIL RAW_VALUE
  1 Raw_Read_Error_Rate     POSR-K   200   200   051    -    0
  3 Spin_Up_Time            POS--K   200   178   021    -    6991
  4 Start_Stop_Count        -O--CK   100   100   000    -    547
  5 Reallocated_Sector_Ct   PO--CK   200   200   140    -    0
  7 Seek_Error_Rate         -OSR-K   200   200   000    -    0
  9 Power_On_Hours          -O--CK   093   093   000    -    5244
 10 Spin_Retry_Count        -O--CK   100   100   000    -    0
 11 Calibration_Retry_Count -O--CK   100   100   000    -    0
 12 Power_Cycle_Count       -O--CK   100   100   000    -    535
192 Power-Off_Retract_Count -O--CK   200   200   000    -    328
193 Load_Cycle_Count        -O--CK   199   199   000    -    5919
194 Temperature_Celsius     -O---K   117   099   000    -    35
196 Reallocated_Event_Count -O--CK   200   200   000    -    0
197 Current_Pending_Sector  -O--CK   200   200   000    -    0
198 Offline_Uncorrectable   ----CK   200   200   000    -    0
199 UDMA_CRC_Error_Count    -O--CK   200   200   000    -    0
200 Multi_Zone_Error_Rate   ---R--   200   200   000    -    0
                            ||||||_ K auto-keep
                            |||||__ C event count
                            ||||___ R error rate
                            |||____ S speed/performance
                            ||_____ O updated online
                            |______ P prefailure warning

General Purpose Log Directory Version 1
SMART           Log Directory Version 1 [multi-sector log support]
Address    Access  R/W   Size  Description
0x00       GPL,SL  R/O      1  Log Directory
0x01           SL  R/O      1  Summary SMART error log
0x02           SL  R/O      5  Comprehensive SMART error log
0x03       GPL     R/O      6  Ext. Comprehensive SMART error log
0x06           SL  R/O      1  SMART self-test log
0x07       GPL     R/O      1  Extended self-test log
0x09           SL  R/W      1  Selective self-test log
0x10       GPL     R/O      1  NCQ Command Error log
0x11       GPL     R/O      1  SATA Phy Event Counters log
0x80-0x9f  GPL,SL  R/W     16  Host vendor specific log
0xa0-0xa7  GPL,SL  VS      16  Device vendor specific log
0xa8-0xb7  GPL,SL  VS       1  Device vendor specific log
0xbd       GPL,SL  VS       1  Device vendor specific log
0xc0       GPL,SL  VS       1  Device vendor specific log
0xc1       GPL     VS      93  Device vendor specific log
0xcf       GPL     VS   65535  Device vendor specific log
0xe0       GPL,SL  R/W      1  SCT Command/Status
0xe1       GPL,SL  R/W      1  SCT Data Transfer

SMART Extended Comprehensive Error Log Version: 1 (6 sectors)
No Errors Logged

SMART Extended Self-test Log Version: 1 (1 sectors)
Num  Test_Description    Status                  Remaining  LifeTime(hours)  LBA_of_first_error
# 1  Extended offline    Completed without error       00%      5227         -
# 2  Short offline       Completed without error       00%      5218         -
# 3  Short offline       Completed without error       00%      5003         -
# 4  Short offline       Completed without error       00%      4979         -
# 5  Extended offline    Completed without error       00%      4966         -
# 6  Short offline       Completed without error       00%      4955         -
# 7  Short offline       Completed without error       00%      4945         -
# 8  Short offline       Completed without error       00%      4834         -
# 9  Short offline       Completed without error       00%      4810         -
#10  Extended offline    Completed without error       00%      4797         -
#11  Short offline       Completed without error       00%      4786         -
#12  Short offline       Completed without error       00%      4762         -
#13  Short offline       Completed without error       00%      4738         -
#14  Short offline       Completed without error       00%      4714         -
#15  Short offline       Completed without error       00%      4690         -
#16  Short offline       Completed without error       00%      4667         -
#17  Short offline       Completed without error       00%      4643         -
#18  Extended offline    Completed without error       00%      4630         -

SMART Selective self-test log data structure revision number 1
 SPAN  MIN_LBA  MAX_LBA  CURRENT_TEST_STATUS
    1        0        0  Not_testing
    2        0        0  Not_testing
    3        0        0  Not_testing
    4        0        0  Not_testing
    5        0        0  Not_testing
Selective self-test flags (0x0):
  After scanning selected spans, do NOT read-scan remainder of disk.
If Selective self-test is pending on power-up, resume after 0 minute delay.

SCT Status Version:                  3
SCT Version (vendor specific):       258 (0x0102)
Device State:                        Active (0)
Current Temperature:                    35 Celsius
Power Cycle Min/Max Temperature:     33/37 Celsius
Lifetime    Min/Max Temperature:     19/53 Celsius
Under/Over Temperature Limit Count:   0/0
Vendor specific:
01 00 00 00 00 00 00 00 00 00 00 00 00 00 00 00
00 00 00 00 00 00 00 00 00 00 00 00 00 00 00 00

SCT Temperature History Version:     2
Temperature Sampling Period:         1 minute
Temperature Logging Interval:        1 minute
Min/Max recommended Temperature:      0/60 Celsius
Min/Max Temperature Limit:           -41/85 Celsius
Temperature History Size (Index):    478 (154)

Index    Estimated Time   Temperature Celsius
 155    2026-10-04 16:28    27  ********
 ...    ..(117 skipped).    ..  ********
 273    2026-10-04 18:26    27  ********
 274    2026-10-04 18:27     ?  -
 275    2026-10-04 18:28    27  ********
 276    2026-10-04 18:29    28  *********
 ...    ..(  3 skipped).    ..  *********
 280    2026-10-04 18:33    28  *********
 281    2026-10-04 18:34    29  **********
 ...    ..(  3 skipped).    ..  **********
 285    2026-10-04 18:38    29  **********
 286    2026-10-04 18:39    30  ***********
 287    2026-10-04 18:40    30  ***********
 288    2026-10-04 18:41    30  ***********
 289    2026-10-04 18:42    31  ************
 ...    ..(  2 skipped).    ..  ************
 292    2026-10-04 18:45    31  ************
 293    2026-10-04 18:46    32  *************
 ...    ..(  5 skipped).    ..  *************
 299    2026-10-04 18:52    32  *************
 300    2026-10-04 18:53    33  **************
 ...    ..(  2 skipped).    ..  **************
 303    2026-10-04 18:56    33  **************
 304    2026-10-04 18:57    34  ***************
 305    2026-10-04 18:58    34  ***************
 306    2026-10-04 18:59    34  ***************
 307    2026-10-04 19:00     ?  -
 308    2026-10-04 19:01    35  ****************
 ...    ..(  4 skipped).    ..  ****************
 313    2026-10-04 19:06    35  ****************
 314    2026-10-04 19:07     ?  -
 315    2026-10-04 19:08    36  *****************
 ...    ..(  2 skipped).    ..  *****************
 318    2026-10-04 19:11    36  *****************
 319    2026-10-04 19:12    37  ******************
 ...    ..(  5 skipped).    ..  ******************
 325    2026-10-04 19:18    37  ******************
 326    2026-10-04 19:19    36  *****************
 ...    ..(  6 skipped).    ..  *****************
 333    2026-10-04 19:26    36  *****************
 334    2026-10-04 19:27    35  ****************
 ...    ..( 12 skipped).    ..  ****************
 347    2026-10-04 19:40    35  ****************
 348    2026-10-04 19:41    34  ***************
 ...    ..( 30 skipped).    ..  ***************
 379    2026-10-04 20:12    34  ***************
 380    2026-10-04 20:13    33  **************
 ...    ..( 22 skipped).    ..  **************
 403    2026-10-04 20:36    33  **************
 404    2026-10-04 20:37    34  ***************
 ...    ..(  3 skipped).    ..  ***************
 408    2026-10-04 20:41    34  ***************
 409    2026-10-04 20:42    35  ****************
 410    2026-10-04 20:43     ?  -
 411    2026-10-04 20:44    35  ****************
 412    2026-10-04 20:45    35  ****************
 413    2026-10-04 20:46    35  ****************
 414    2026-10-04 20:47    36  *****************
 415    2026-10-04 20:48     ?  -
 416    2026-10-04 20:49    36  *****************
 ...    ..(  3 skipped).    ..  *****************
 420    2026-10-04 20:53    36  *****************
 421    2026-10-04 20:54    37  ******************
 ...    ..(  3 skipped).    ..  ******************
 425    2026-10-04 20:58    37  ******************
 426    2026-10-04 20:59    36  *****************
 ...    ..(  6 skipped).    ..  *****************
 433    2026-10-04 21:06    36  *****************
 434    2026-10-04 21:07    35  ****************
 ...    ..( 13 skipped).    ..  ****************
 448    2026-10-04 21:21    35  ****************
 449    2026-10-04 21:22    34  ***************
 ...    ..( 59 skipped).    ..  ***************
  31    2026-10-04 22:22    34  ***************
  32    2026-10-04 22:23    33  **************
 ...    ..(  4 skipped).    ..  **************
  37    2026-10-04 22:28    33  **************
  38    2026-10-04 22:29    34  ***************
 ...    ..(  3 skipped).    ..  ***************
  42    2026-10-04 22:33    34  ***************
  43    2026-10-04 22:34    35  ****************
 ...    ..(  4 skipped).    ..  ****************
  48    2026-10-04 22:39    35  ****************
  49    2026-10-04 22:40    36  *****************
 ...    ..(  4 skipped).    ..  *****************
  54    2026-10-04 22:45    36  *****************
  55    2026-10-04 22:46    37  ******************
 ...    ..(  2 skipped).    ..  ******************
  58    2026-10-04 22:49    37  ******************
  59    2026-10-04 22:50    36  *****************
 ...    ..(  5 skipped).    ..  *****************
  65    2026-10-04 22:56    36  *****************
  66    2026-10-04 22:57    35  ****************
 ...    ..(  6 skipped).    ..  ****************
  73    2026-10-04 23:04    35  ****************
  74    2026-10-04 23:05    34  ***************
  75    2026-10-04 23:06    34  ***************
  76    2026-10-04 23:07    35  ****************
  77    2026-10-04 23:08    27  ********
 ...    ..( 76 skipped).    ..  ********
 154    2026-10-05 00:25    27  ********

SCT Error Recovery Control command not supported

Device Statistics (GP/SMART Log 0x04) not supported

Pending Defects log (GP Log 0x0c) not supported

SATA Phy Event Counters (GP Log 0x11)
ID      Size     Value  Description
0x0001  2            0  Command failed due to ICRC error
0x0002  2            0  R_ERR response for data FIS
0x0003  2            0  R_ERR response for device-to-host data FIS
0x0004  2            0  R_ERR response for host-to-device data FIS
0x0005  2            0  R_ERR response for non-data FIS
0x0006  2            0  R_ERR response for device-to-host non-data FIS
0x0007  2            0  R_ERR response for host-to-device non-data FIS
0x0008  2            0  Device-to-host non-data FIS retries
0x0009  2            5  Transition from drive PhyRdy to drive PhyNRdy
0x000a  2            6  Device-to-host register FISes sent due to a COMRESET
0x000b  2            0  CRC errors within host-to-device FIS
0x000f  2            0  R_ERR response for host-to-device data FIS, CRC
0x0012  2            0  R_ERR response for host-to-device non-data FIS, CRC
0x8000  4         8478  Vendor specific

